{
  "$schema": "https://json-schema.org/draft/2020-12/schema",
  "$id": "https://foundergate.local/adapters/registry/registry.schema.json",
  "title": "Worker Adapter Registry",
  "description": "Research/data-only registry that INDEXES candidate autonomous coding workers (OpenHands, Aider, SWE-agent, Claude Code, Codex-style) and, for each, the interface it presents (a locally-copied H7 worker-adapter descriptor) PLUS the registry-level lifecycle label, the exact permissions the worker would require, and the founder gates that MUST be cleared before it could ever be installed. This registry is a SPEC INDEX, never runtime: reading, validating, or extending it installs nothing, fetches nothing over the network, holds no credentials, and activates no application runtime. The `lifecycle` field (research | planned | installed) is the anti-fake-state axis: `research` and `planned` entries MUST be status:planned + installed:false, so an un-installed worker can never be presented as live. research != installed.",
  "type": "object",
  "additionalProperties": false,
  "required": [
    "schema_version",
    "registry_id",
    "generated_by",
    "research_only",
    "no_install",
    "no_credentials",
    "no_network_fetch",
    "lifecycle_legend",
    "adapters"
  ],
  "properties": {
    "schema_version": {
      "description": "Semantic version of this registry schema the emitter targeted.",
      "type": "string",
      "pattern": "^[0-9]+\\.[0-9]+\\.[0-9]+$"
    },
    "registry_id": {
      "description": "Stable machine identifier for this registry document.",
      "type": "string",
      "pattern": "^[a-z0-9][a-z0-9-]{1,63}$"
    },
    "generated_by": {
      "description": "The lane/phase that authored this registry (provenance, not an execution grant).",
      "type": "string",
      "minLength": 1
    },
    "research_only": {
      "description": "MUST be true. This registry is research/data only; it never crosses into install or runtime.",
      "type": "boolean",
      "const": true
    },
    "no_install": {
      "description": "MUST be true. Building/reading this registry installs no worker.",
      "type": "boolean",
      "const": true
    },
    "no_credentials": {
      "description": "MUST be true. This registry holds no secrets/credentials/tokens for any worker.",
      "type": "boolean",
      "const": true
    },
    "no_network_fetch": {
      "description": "MUST be true. This registry was assembled from documented knowledge, not a live network fetch.",
      "type": "boolean",
      "const": true
    },
    "lifecycle_legend": {
      "description": "Human legend for the lifecycle axis so research/planned/installed are never conflated.",
      "type": "object",
      "additionalProperties": false,
      "required": ["research", "planned", "installed"],
      "properties": {
        "research": { "type": "string", "minLength": 1 },
        "planned": { "type": "string", "minLength": 1 },
        "installed": { "type": "string", "minLength": 1 }
      }
    },
    "adapters": {
      "description": "The registry entries. At least the five surveyed candidate workers.",
      "type": "array",
      "minItems": 5,
      "uniqueItems": true,
      "items": { "$ref": "#/$defs/registry_entry" }
    }
  },
  "$defs": {
    "registry_entry": {
      "type": "object",
      "additionalProperties": false,
      "required": [
        "adapter_id",
        "worker_name",
        "vendor",
        "lifecycle",
        "one_line",
        "homepage_reference",
        "license_note",
        "required_permissions",
        "founder_gates_before_install",
        "install_blockers",
        "descriptor"
      ],
      "properties": {
        "adapter_id": {
          "description": "Stable kebab-case id; matches descriptor.adapter_id.",
          "type": "string",
          "pattern": "^[a-z0-9][a-z0-9-]{1,63}$"
        },
        "worker_name": {
          "description": "Human-readable worker name.",
          "type": "string",
          "minLength": 1,
          "maxLength": 120
        },
        "vendor": {
          "description": "Who publishes the worker (organization/community), for provenance only.",
          "type": "string",
          "minLength": 1
        },
        "lifecycle": {
          "description": "research = surveyed only, no descriptor exercised; planned = design-only descriptor sketched, not installed; installed = actually present + in-use in THIS environment. Bound to descriptor.status/installed by the H35 selftest invariants.",
          "type": "string",
          "enum": ["research", "planned", "installed"]
        },
        "one_line": {
          "description": "One-line summary of what the worker is.",
          "type": "string",
          "minLength": 1,
          "maxLength": 400
        },
        "homepage_reference": {
          "description": "A documentation pointer (project name / repo path as a string). NOT fetched; provenance label only.",
          "type": "string",
          "minLength": 1
        },
        "license_note": {
          "description": "Known license family for the worker (research note, verify before any install).",
          "type": "string",
          "minLength": 1
        },
        "required_permissions": {
          "description": "The concrete host permissions the worker WOULD require to run (filesystem scope, shell, network egress, model API access, container/sandbox). Declared for review; NOT granted here.",
          "type": "array",
          "minItems": 1,
          "uniqueItems": true,
          "items": { "type": "string", "minLength": 1 }
        },
        "founder_gates_before_install": {
          "description": "The founder gates that MUST be cleared before this worker could be installed/admitted. At least one; every non-installed worker keeps an 'install' gate here.",
          "type": "array",
          "minItems": 1,
          "uniqueItems": true,
          "items": {
            "type": "string",
            "enum": [
              "install-approval",
              "credentials-provisioning",
              "OAuth-consent",
              "network-egress-allowlist",
              "model-api-key",
              "sandbox-review",
              "container-isolation",
              "license-review",
              "contract-proof",
              "live-crossing"
            ]
          }
        },
        "install_blockers": {
          "description": "Why this worker is NOT installed right now (honest blockers). For an installed worker: an empty array is allowed.",
          "type": "array",
          "uniqueItems": true,
          "items": { "type": "string", "minLength": 1 }
        },
        "descriptor": {
          "description": "The H7-shape worker-adapter descriptor for this worker, validated against the locally-copied worker-adapter.embedded.schema.json.",
          "$ref": "worker-adapter.embedded.schema.json"
        }
      }
    }
  }
}
