{
  "schema_version": "1.0.0",
  "registry_id": "worker-adapter-registry",
  "generated_by": "foundergate/h35-worker-adapter-registry (isolated-writer, research/data-only)",
  "research_only": true,
  "no_install": true,
  "no_credentials": true,
  "no_network_fetch": true,
  "lifecycle_legend": {
    "research": "Surveyed from documented knowledge only. No descriptor is exercised, nothing is installed, and admitting this worker still requires its own contract proof + founder gates.",
    "planned": "A design-only H7-shape descriptor is sketched (how the worker WOULD present the harness interface). Still not installed; installed:false is enforced.",
    "installed": "The worker is actually present and in-use in THIS environment right now (status:real, installed:true), with live integration evidence."
  },
  "adapters": [
    {
      "adapter_id": "claude-code",
      "worker_name": "Claude Code",
      "vendor": "Anthropic",
      "lifecycle": "installed",
      "one_line": "Anthropic's official CLI coding agent; runs isolated writer lanes inside a git worktree, commits once, opens a draft PR, never merges.",
      "homepage_reference": "Anthropic Claude Code CLI (docs.claude.com/claude-code)",
      "license_note": "Proprietary (Anthropic commercial terms); model access via Anthropic API / subscription.",
      "required_permissions": [
        "filesystem:worktree-scoped read/write inside the assigned lease",
        "shell:offline (bounded, no unbounded egress)",
        "git:commit-local + push own foundergate/* branch",
        "model-api:Anthropic (Claude) for the agent loop",
        "gh:pr-create-draft + request-review"
      ],
      "founder_gates_before_install": [
        "model-api-key",
        "contract-proof"
      ],
      "install_blockers": [],
      "descriptor": {
        "schema_version": "1.0.0",
        "adapter_id": "claude-code",
        "worker_name": "Claude Code",
        "status": "real",
        "installed": true,
        "description": "REAL, in-use worker (this registry entry mirrors the H7 claude-code.real descriptor). Claude Code runs an isolated writer lane inside its own git worktree, touches only files inside its declared file lease, commits once, pushes its own branch, and opens a draft PR requesting a Copilot review. It never merges (the Terminal-0 sheriff merges) and never activates application runtime or a forbidden provider.",
        "privileged_execution": false,
        "activates_runtime": false,
        "input_contract": {
          "mission": "A single scoped mission statement handed to the lane as its task prompt (director/orchestrator message; never treated as founder consent).",
          "lease_globs": [
            "harness/adapters/**",
            "docs/harness/H*.md"
          ],
          "branch": "foundergate/<lane-slug> assigned by the orchestrator; the lane stays on it and never switches.",
          "base_ref": "origin/main",
          "hard_exclusions": [
            "no git push to a shared/protected branch beyond the lane's own",
            "no git merge / no self-merge",
            "no provider mutation (email/calendar/chat/browser/session)",
            "no privileged / permission-mode-escape execution",
            "no application runtime activation or marker flip",
            "no package/lockfile/Docker/launchd/infra edits",
            "no secrets/creds/OAuth handling"
          ]
        },
        "allowed_tools": [
          "Read",
          "Edit",
          "Write",
          "Grep",
          "Bash:offline",
          "git:commit-local",
          "git:push-own-branch",
          "gh:pr-create-draft",
          "gh:request-review"
        ],
        "forbidden_tools": [
          "git:merge",
          "git:push-protected",
          "provider:send",
          "provider:archive-delete-rsvp",
          "permission-mode-escape",
          "network:egress",
          "package-or-lockfile-edit",
          "docker-or-launchd-mutation"
        ],
        "expected_outputs": {
          "artifacts": [
            "files inside the assigned lease only"
          ],
          "commit_required": true,
          "one_commit_per_task": true,
          "commit_message_convention": "proof(...) or feat(...) subject line ending with the Co-Authored-By: Claude trailer"
        },
        "proof_packet": {
          "required": true,
          "kinds": ["ci-safety", "selftest", "diff-summary"],
          "must_include": ["head_sha", "branch", "pr_number", "ci_result", "selftest_name"],
          "docs_never_runtime": true
        },
        "progress_status": {
          "reporting": "background-callback",
          "states": ["queued", "running", "proof", "handoff", "done", "blocked"]
        },
        "failure_mode": {
          "on_failure": "clear-failure-marker",
          "returns_marker": true,
          "partial_allowed": true,
          "no_fake_completion": true
        },
        "gate_report": {
          "surfaces_gate": true,
          "gate_categories": ["legal", "IP", "public", "secrets", "external-account", "payment", "OAuth", "live-crossing"],
          "delivery": "pr-body",
          "never_self_clears": true
        },
        "pr_handoff": {
          "opens_pr": true,
          "pr_state": "draft",
          "merges": false,
          "requests_review": ["copilot-pull-request-reviewer[bot]"],
          "body_convention": "PR body ends with the Generated-with-Claude-Code trailer; a GATE REPORT block is included when a true founder gate appears."
        },
        "integration_evidence": [
          "REAL: exercised by the foundergate/* isolated-writer lanes (the H-series harness).",
          "REAL: workflow matches the isolated-writer contract in docs/contracts/AGENT_CONSTITUTION.md (file-lease + no-self-merge)."
        ]
      }
    },
    {
      "adapter_id": "aider",
      "worker_name": "Aider (planned)",
      "vendor": "Aider AI / community (Paul Gauthier)",
      "lifecycle": "planned",
      "one_line": "Terminal pair-programming agent that edits a local git repo and auto-commits each change; model-agnostic via API keys.",
      "homepage_reference": "aider.chat / github.com/Aider-AI/aider",
      "license_note": "Apache-2.0 (verify current license before any install).",
      "required_permissions": [
        "filesystem:worktree-scoped read/write inside the assigned lease",
        "shell:offline for edit-test loops",
        "git:commit-local (Aider auto-commits)",
        "model-api:external LLM key (OpenAI/Anthropic/etc.) selected at config time",
        "network:egress to the chosen model endpoint"
      ],
      "founder_gates_before_install": [
        "install-approval",
        "model-api-key",
        "network-egress-allowlist",
        "license-review",
        "contract-proof"
      ],
      "install_blockers": [
        "PLANNED / NOT-INSTALLED: Aider is not present in this environment.",
        "Requires an external model API key that the harness does not hold (credentials gate).",
        "Needs a scoped network-egress allowlist for the model endpoint (egress gate)."
      ],
      "descriptor": {
        "schema_version": "1.0.0",
        "adapter_id": "aider",
        "worker_name": "Aider (planned)",
        "status": "planned",
        "installed": false,
        "description": "PLANNED adapter — Aider is NOT installed and NOT wired into the harness. Design-only sketch of how an Aider worker WOULD present the harness interface: it edits files inside a single worktree/lease and auto-commits, then hands the branch off for the Terminal-0 sheriff. Aider talks to an external model endpoint, so its egress and credentials gates are explicit. Nothing here installs, configures, keys, or authorizes Aider; admission would require its own contract proof and the standard founder gates.",
        "privileged_execution": false,
        "activates_runtime": false,
        "input_contract": {
          "mission": "PLANNED: a single scoped mission would be delivered as the Aider chat/task instruction.",
          "lease_globs": [
            "PLANNED: the lane's file-lease glob(s), enforced by the harness outside the worker"
          ],
          "branch": "PLANNED: a harness-assigned foundergate/<slug> branch; no branch switching.",
          "base_ref": "origin/main",
          "hard_exclusions": [
            "no git merge / no self-merge",
            "no provider mutation (email/calendar/chat/browser/session/keychain)",
            "no privileged / permission-mode-escape execution",
            "no application runtime activation or marker flip",
            "no package/lockfile/Docker/launchd/infra edits",
            "no unbounded network egress beyond the approved model endpoint",
            "no secrets/creds/OAuth handling by the lane"
          ]
        },
        "allowed_tools": [
          "Read",
          "Edit",
          "Write",
          "Bash:offline",
          "git:commit-local",
          "git:push-own-branch"
        ],
        "forbidden_tools": [
          "git:merge",
          "git:push-protected",
          "provider:send",
          "provider:archive-delete-rsvp",
          "permission-mode-escape",
          "network:egress-unbounded",
          "package-or-lockfile-edit",
          "docker-or-launchd-mutation"
        ],
        "expected_outputs": {
          "artifacts": [
            "PLANNED: files inside the assigned lease only"
          ],
          "commit_required": true,
          "one_commit_per_task": false,
          "commit_message_convention": "PLANNED: Aider auto-commits per edit; the harness would squash to one proof(...) commit with the Co-Authored-By trailer before handoff."
        },
        "proof_packet": {
          "required": true,
          "kinds": ["ci-safety", "test-output", "diff-summary"],
          "must_include": ["head_sha", "branch", "pr_number", "ci_result"],
          "docs_never_runtime": true
        },
        "progress_status": {